Word Order,Frequency_SSJ,Example_Sentence_SSJ,Frequency_SST,Example_Sentence_SST
VOVSVSO,1.0,"S testiranjem vnetja lahko določimo , komu preti srčni napad , čeprav ima bolnik normalen ali celo nizek holesterol .",1.0,potem dobiš kakšnega Francoza ki zaluta gor po Škocjanu jaz ne vem tisti garmin jih
VOVSVSSV,1.0,"Kar videla sta , kako jim žarijo oči in kako s ponosom pritrjujejo , da je to prav tista violina , s katero je Žiga zmagal .",0.0,0
VOVSVSVVSV,0.0,0,1.0,eee in eee mogoče če kar takoj omenim to temo na področju kemičnega orožja obstajajo določene mednarodne eee deklaracije sporazumi eee ki govorijo o tem da se to ne sme uporabljati medtem ko na področju robotov pa to zaenkrat še ni
VOVSVV,3.0,"Prosim , da prijave oddajo tudi ostali , ki želijo pod to točko dnevnega reda sodelovati v razpravi , zlasti pa",2.0,nimamo miru zdaj če je mi delamo kao veš si po mojem
VOVSVVO,0.0,0,1.0,povedala ampak ponavadi eem gostom ker je pač oddaja Se res poznamo postavim na začetku zelo podobno vprašanje
VOVSVVVVO,0.0,0,1.0,zdi se mi da lahko z učenjem nenasilne komunikacije pripomorem k spremembam v tem svetu in sicer da se spremembe dogajajo skozi male ljudi ki se naučijo komunicirati izražati svoja čustva s tem e
VOVV,43.0,"Zato je včeraj sklicala sestanek , na katerem so ugotavljali , kako bi prišli do najprimernejše rešitve .",25.0,vedeli ker je bila jesen ali nas bo zeblo ali bo v redu
VOVVO,28.0,"Smo gverilci in uporabljamo orožje , toda le zato , ker ne vemo , kako bi drugače dosegli spremembe .",10.0,mislim pa mmm da mi res podtikajo meni pa tudi še gospodu Turnšku ki je pred mano vodil to podjetje
VOVVOO,1.0,"Po vsebinskih poudarkih so sicer različni , a njihova skupna značilnost je , da poskušajo strokovni gordijski vozel razmejitve presekati tako , da pripišejo narodu druge države negativne kolektivne lastnosti .",0.0,0
VOVVOOSV,0.0,0,1.0,tudi leta devetnajsto dvaindvajset tako kot je prej omenjal robote ali pa recimo če omenim Slovenijo isto mi delamo
VOVVOOVS,2.0,"Niso poslušali potnikov , ki so bili dnevno v stiku s trgovci in so dejansko vedeli , kaj ti potrebujejo , česa",0.0,0
VOVVOS,0.0,0,1.0,kot sem že rekla kadrovsko e kadrovsko že zadevo zelo težko težko obvladujemo eee kajti zgodil se nam je tudi vdor v belo cono tako kot tudi po drugih bolnišnicah
VOVVOSOV,0.0,0,1.0,ustavljal pri različnostih ampak vedno mi je bilo všeč da sem iskal pri vsakemu človeku tisto kar naju povezuje
VOVVOSOVS,1.0,"Medtem ko so si lepo vzeli časa za bombardiranje , so se sestajali na konferencah ter velikopotezno in prazno planirali : delitev Nemčije na okupacijske cone , odpravo nemške vojske in generalštaba za vse večne čase , fantastične premike meja na vzhodu : Poljska naj bi bila za območja , ki si jih je vzel Rus ,",0.0,0
VOVVOSSSV,1.0,"razvilo v nasprotje med nečim , kar so imenovali eros in naj bi predstavljalo prijazno urejenost svetovij , ljubezen med njimi ter kaos , kar naj bi bilo sovražni nered , zmešnjava in nasilje ; vse , kar poslej nastaja živega in mrtvega , je",0.0,0
VOVVOSVSOV,1.0,"boji pa se vojne z Rusijo , v kateri bi morala nositi glavno težo , fronto v Galiciji , medtem ko bi Prusija počela v Nemčiji , kar bi se ji zahotelo ; na drugi strani pa se spet",0.0,0
VOVVOV,8.0,"Zdaj , ko smo z njega na varno umaknili občutljivke , ki nočejo niti slišati za mraz , ga lahko olepšamo bolj preprosto , z manj rastlinami , zasajenimi v loncu ali dveh .",2.0,dajta mi malo za piti a veš pa me zebe sem
VOVVOVO,1.0,"predlagajo , da dolg poravnajo in izpolnijo z zakonom določene naloge , s katerimi zmanjšajo škodljive posledice kaznivega dejanja ; največkrat",0.0,0
VOVVOVOVO,1.0,"obvladuje objekt svoje sebično razuzdane fantazije , Evropo , kako lahko poveljuje med Madridom in Moskvo , kako mobilizira milijonske armade , ne da bi imel za njihove premike na razpolago primerna sredstva , in ali ima med hladnim diktiranjem svojih ukazov vedno pred očmi tudi njihov propagandni učinek .",0.0,0
VOVVOVOVOSV,0.0,0,1.0,in tukaj imamo e zdaj prikaz deleža otrok z debelostjo v letu dva devetnajst se pravi pred epidemijo deleža otrok e z debelostjo danes v tistih šolah ki so že dobile povratne informacije leta dva tisoč dvajset in pa na koncu delež otrok z debelostjo v tistih šolah ki niso dobile povratne informacije in niso imeli natančnih e podatkov o tem kaj se je z otroki dogajalo
VOVVOVOVVO,1.0,"ima pravico in v imenu česa zahtevati od nekega naroda ali celi vrsti njih , da naj preslišijo glas svoje identitete , in torej molče prenašajo politično in duhovno unificiranje in to za vso prihodnost naprej , se pravi tudi za prihodnje rodove ? ki naj bi uničila Jugoslavijo .",0.0,0
VOVVOVS,1.0,"Stopil sem na začetek vrste , vendar so me sprva zavrnili , dokler nisem povedal , da me je poslal Nurejev .",0.0,0
VOVVOVSOSVOV,1.0,"Če prodajate hišo in pozabite omeniti , da jo bo ob jesenskem deževju zalila voda , vam ne bo nihče dokazoval , da ste to zamolčali namenoma .",0.0,0
VOVVOVSOV,1.0,"Dajte vse od sebe , potrudite se po najboljših močeh , delajte , kar ljubite , in življenje vam bo vrnilo v enaki meri .",0.0,0
VOVVOVSS,1.0,"Pri nas sicer niso delali podobnih poskusov , a v Ameriki so se potrudili in pri 2500 zaposlenih , ki so kadili hašiš , ugotovili , da se je število delovnih nezgod ( dr. Bilban je za potrebe stroke",0.0,0
VOVVOVSSVSS,0.0,0,1.0,obračali celo besede da gre program ki je javno veljaven zato da bi priredili zakonsko razlago Zakona torej o osnovni šoli ki govori da je obve- eee da je javno veljavni program razdeljen na obvezni in razširjeni program in obvezni vemo kaj je vsi matematika in tako naprej to so tisti
VOVVOVSVO,1.0,"Takoj je bilo jasno , da gre za mamila , zato so mladoletnico privedli na piransko policijsko postajo , kjer so opravili preliminarni test , ki je pokazal , da je G. M. skrivala 19 tablet ecstasyja , 4,5 grama amfetamina in nekaj marihuane .",0.0,0
VOVVOVV,0.0,0,1.0,e recimo večinoma jim da toliko da recimo kakšne kredite lahko plačajo ne vem
VOVVOVVVSVOVOVSV,0.0,0,1.0,mislim smo tam svoje mnenja kar kompaktno in koherentno zastopali tako da zdaj nismo dajali dodatnih e dodatnih komentarjev saj za temi stališči v celoti stojimo in eem moram reči da je e pripravljalec zakona dojel pomen direktive in da je tudi pravilno pristopil k obravnavi tega člena ki ga je transponiral sedeminštiridesetib člen če se ne motim
VOVVOVVVV,1.0,"S pogledom sem ošinil svojega šoferja in se prepričal , da bo ostal miren in da se mi ne bo skušal približati ali pokazati , da se poznava .",0.0,0
VOVVOVVVVO,0.0,0,1.0,tiče prehrane se pravi ne jejo e mlečnih izdelkov pa ne jajc pa meda ne pa se pravi kot sem že prej rekla tudi eem bolj gledajo na na to da kupujejo kozmetiko ki ni pač eee testirana na živalih
VOVVS,13.0,"konča pa s stvarjo , ki me pravzaprav najbolj skrbi , namreč definicija na koncu obstajajo tudi možnosti nastajanja povsem novih oblik ogrožanja nacionalne varnosti .",4.0,tu imamo tudi graf kjer imamo eee prikazano koliko je kakšno je to razmerje zasebne javne univerze v Evropi
VOVVSO,1.0,"to je bila že dosti prej , ko se je sama lotila beletrije – in iz kritik , objavljenih večinoma v literarni prilogi Timesa , razbrale , da velja njeno posebno zanimanje romanu , njegovi preteklosti in prihodnosti .",0.0,0
VOVVSOV,2.0,"Kaže , da Sloveniji ni mar za svoje imetje , za svoje ljudi in zato ne čudi izjava Franca Droleta , predsednika kobariške mlekarne , na včerajšni tiskovni konferenci : "" Če Ljubljani ni mar za nas , se bomo pa",1.0,da zmoreš e hojo moraš vedeti kaj te čaka
VOVVSOVSOVV,1.0,"Če bi med številnimi raziskavami tržišča naredili še kakšno o tem , bi jim postalo kaj hitro jasno , da je večina klobas Poli v hladilnikih le zato , ker jih imajo radi otroci - kategorija potrošnikov , ki jo bodo v PP morali vzeti bolj resno kot doslej .",0.0,0
VOVVSS,0.0,0,1.0,in eee pre- in zato smo tudi predlagali da glede na to da bi radi več stvari uredili pa v zakonu ni podlage da bi bilo dobro glede na to da je zakon o izvrševan kazenskih sankcij zdaj v eee v pred- eee predviden za spremembe
VOVVSSOVVOV,0.0,0,1.0,vprašanje eee to pa eee če če nabavim to imate k- kako je tako zdaj ena cena za en mesec če bi jaz to hotel pač en mesec hotel to jest
VOVVSSVOVOSV,0.0,0,1.0,zdaj če greva klasična polena reči potem je takoj potem je to peč kjer se zdaj te ki so novejše so take da v bistvu eee da v bistvu imate dve neke vrste spodnji kurišči kjer u- uplinjate to ta les in potem se v bistvu ti plini izgoreva
VOVVSSVV,0.0,0,1.0,hoče denar od njega speljati in po raznih peripetijah v mestu se potem vseeno zgodi happy end spet nazaj na vasi eee kjer e se stvari umirijo uredijo in to zelo na kratko
VOVVSV,1.0,"poznam radijce in verjemite , da je tako ! ) poslanci javno povedali , da je krivda za vse to še kje drugje .",1.0,dobi podatek ko se doma sprašuje ali je to v redu ali ni v redu
VOVVSVO,1.0,"Pred nedavnim sem zasledil podatek , da je v obdobju , ko je delovala na Prevaljah , kot se uradno reče , Mohorjeva družba izdala dva milijona knjig !",0.0,0
VOVVSVOOVS,1.0,"Zakaj bi , če že strežemo nebrzdanim apetitom po dobičku , ki tako ali tako nikoli ne gre v delavske žepe , niti po drobtinicah , ne delali ob nedeljah še sodniki , ki imajo zaostanke , pa poslanci , ki jih čaka kar nekaj zakonov , pa . . . """,0.0,0
VOVVSVOV,1.0,"dela in kaj pripoveduje , da je napravil Skepsa novega rodu Spomini na prvo čolnarjenje Vožnja s splavom George opravi stvar v stilu Stari čolnar , njegova metoda Tako miren , tako spokojen Začetnik Čolnarjenje z drogom Žalosten dogodek Radosti prijateljstva Jadranje , moja prva izkušnja Možen razlog , zakaj se nismo potopili",0.0,0
VOVVSVOVS,1.0,"želijo nič slišati in pravijo , da se takšne vrste povračilo v Evropi že dolgo ne uporablja več in so ga nadomestili recipročni poleti .",0.0,0
VOVVSVVVO,0.0,0,1.0,ker eee veste da pač tovorni promet eee eee oziroma eee eee adaptacije na progi delamo pod prometom se pravi oba dva tima tako infrastruktura kot tovorni in potniški promet se morata bistveno natančneje usklajevati zato da sta lahko dosegla to rast
VOVVV,12.0,"Spoznaval sem , morda prvič , da o vsej silni želji in hotenju , ki ga je zganila v meni , ni mogoče povedati z besedami , zato nisem niti poskusil .",7.0,ne vemo pa tistih drobnih stvari ki kar nekako sodijo v našo oddajo ki se imenuje Se res poznamo
VOVVVO,8.0,"» Nikoli nisem mogel nič doseči preprosto , zato sem začel iskati druge poti .",4.0,aha če pa nimam tega rednega mesečnega priliva oziroma pač rednega priliva je pa pol pa se ne da imeti limita ali kako
VOVVVOS,1.0,"Čeprav imamo lahko Leonarda na sumu , da je malce pretiraval , ker se je hotel rešiti neugodnega naročila , je ta anekdota značilna .",1.0,izogibajo pa pol pač eem to vržejo v smeti ker pač nočejo nekako kazati svetu da je to sprejemljivo
VOVVVOV,3.0,"Glede Vaše samohvale , koliko da ste pripomogli k reševanju omenjenih projektov , pa Vam moram povedati , da sem zbral podatke za občini Jesenice in Kranjska Gora , iz katerih je razvidno , da NI RES , da ste lahko zadovoljni .",2.0,poznati šolstvo pomeni delati v šolstvu imeti otroke v šolstvu biti še kak inšpektor za ne vem kaj vse
VOVVVOVO,1.0,"Posebej skuhamo cvetačo in brokoli , odcedimo , grobo nasekljamo ter dodamo krompirjevi masi , v katero smo dali jajce , moko , polovico drobtin , maslo in začimbe .",0.0,0
VOVVVOVOO,0.0,0,1.0,da da se malo otrok eem da izgubi strah pred vodo eem in da je pripravljen eem neobremenjeno brez strahu eem iti vanjo se potunkati zmočiti obraz zmočiti glavo eem se mi
VOVVVOVS,1.0,"Za vse , ki imajo doma več računalnikov , ali pa gre za malo pisarno , kjer bi želeli namesto sprehoda v drugo sobo poiskati datoteke prek omrežja , obstaja rešitev .",1.0,primerih ko ne dosežejo tistih trideset dni bolniškega staleža ampak pridejo nekje recimo do petindvajset osemindvajset eee eee in dejansko sploh ne pride do tistega trenutka ko bi karkoli dobili povrnjeno iz zdravstvene blagajne sama sem se
VOVVVS,1.0,"je iz ene od držav EU , vendar nam je takoj povedal , da morajo biti za to tudi drugi , med temi tudi naša",1.0,in seveda vlekel sem vprašanja noter in sem gledal samo da izvlečem da popravljam jaz da
VOVVVSS,1.0,"Pri tem pa v strokovni službi zavoda opozarjajo , da se bo pri deležu sredstev , ki bi jih bilo treba zagotoviti v državnem proračunu za zakonsko predvideno izravnano bilanco prihodkov in odhodkov zavoda , ponovila stara zgodba : tudi letos bo vlada",0.0,0
VOVVVV,3.0,"Za seboj ima odlično sezono , v kateri sicer ni igral veliko , a je lahko spoznal , kako se živi in igra zunaj Slovenije , ob tem pa je brez težav",5.0,hočeš da redarje pokličem daj daj daj
VOVVVVO,1.0,"Na četrtkovi seji občinskega sveta , na kateri so sicer pričakovali tudi ministra Rada Bohinca , je bilo med razlogi , zakaj da so proti novim nastanitvam , slišati tudi , da imajo s tujci pač » bogate « izkušnje .",2.0,in ni dovolil da to eee mešajo oziroma sploh ni dovolil da eee začnejo barvati fasado
VOVVVVOVVS,0.0,0,1.0,preselila v Slovenijo in eee tukaj mogoče že en del tega uspeha ki ga vidim je da ko sem prišla v Slovenijo brez eee brez kakršnekoli izkušnje v socialističnem izobraževalnem sistemu ne ker sem v Ameriko šla že za eee gimnazijo in za fakulteto eee da sem mogoče malo prisilila tudi svoje sodelavce kot študente da malo think out of the box s tem s to mogoče predrznostjo a ne ko sem prišla in sem rekla Jaz bi rada
VOVVVVV,1.0,"Zdi se mu , da se samo zaradi svoje pretankovestne narave bojim , da dobivam več kot svoj pravični delež ; in da v resnici nimam niti pol toliko , kakor bi moral imeti .",4.0,veš kaj bom danes eee zdajle grem grem ravno zdajle grem v Zagreb pa se dobim z eno njihovo piarovko
VOVVVVVOVOVOSVVOOVVS,1.0,"zgleda , da ga nočete poslušati - sem se vendarle odločil , da se oglasim in povem tisto , ker pač moramo vse povedati , kar kdo ve , da bi morda zbrali skupaj nekaj , kar bi bilo lahko tudi blizu resnici , če namreč nočemo , večina",0.0,0
VOVVVVVV,0.0,0,1.0,no in daj mi povej a je eee kako a ka- kako je bilo delati kako je delati na majhni nikak- torej eee zelo majhni televiziji no
VOVVVVVVVVOSO,1.0,"Bila je čisto na dnu košare in menda jo je bilo težko najti , zato se je moral sklanjati globlje in globlje , in ker je v tem na glavo obrnjenem položaju poskušal hkrati krmariti , je potegnil za napačno vrv in zasuknil čoln v breg ; sunek ga je",0.0,0
VS,956.0,izjavil morilec .,344.0,vidite lahko da je zelo zelo natančno vse nekaj izrisano na tej vaški situli
VSO,65.0,"Lahko je spal deset , dvanajst ur , žena mu je vedno",28.0,pa imam jaz tudi svoje obveznosti
VSOO,2.0,"Tu imamo Slovenci svojo priložnost , nekatere osnovne vzvode",1.0,je zdaj tu eee varianta teh dvometrskih mi je
VSOOSVSV,1.0,"Sicer pa imata Adria in Jat še stare nerazčiščene finančne zadeve , ki jih bo Adria potegnila iz rokava , če se bo položaj zaostril .",0.0,0
VSOOV,2.0,"Ob 50 - letnici delovanja odpira Koroški pokrajinski muzej priložnostno razstavo s pregledom razvoja in delovanja muzeja od ustanovitve okrajnega muzeja NOB leta 1951 do zadnjega desetletja delovanja , ko so težišče dela preusmerili na skrb za varstvo premične kulturne dediščine na območju Koroške v Republiki Sloveniji .",6.0,mhm ima gospa [name:personal] kakšno mobilno telefonsko številko ker jo potrebujemo zaradi potrebe obveščanja
VSOOVOVSVO,1.0,"Rade bi mislile , da so naši pozivi k realnim svetovom več kot le obupan odmik od cinizma in dejanje vere , podobno kakšnemu drugemu kultu , ne glede na to , koliko prostora radodarno namenimo bogatim in vedno zgodovinsko specifičnim posredovanjem , s katerimi moramo me in vsi drugi spoznavati svet .",0.0,0
VSOOVSVVOO,0.0,0,1.0,in kljub temu da imajo škratje neke moči pa vilini moči na koncu e v bistvu glavno vlogo odigra en majhni hobit ki potuje skozi te dežele in nosi e prstan v Goro pogube kjer ga na koncu seveda zopet
VSOOVV,1.0,"imel Aristarhov heliocentrični sistem nekaj velikih in tehtnih pomanjkljivosti , ki jih nikakor niso mogli kar tako spregledati .",0.0,0
VSOOVVO,1.0,"V luči tega igrajo pokrajine , regije , mreže in združenja občin ključno vlogo pri tem , da podpisnikom pomagajo izpolniti njihove obveznosti .",0.0,0
VSOOVVS,0.0,0,1.0,potem moram jaz to skico jim do nnn narisati poslati oni mmm
VSOOVVSOV,1.0,"očitajo kranjski sindikati predsedniku Iskre Holding , ki mu , kot pravijo , propade vse , česar se loti : Iskra Handels , Iskra MTP , Iskre Francija in New York , polom košarkarske reprezentance Slovenije na evropskem prvenstvu . . .",0.0,0
VSOOVVSVOOS,0.0,0,1.0,upošteval je tudi naš pripravljalec zakona e to da se iste izjeme izvzame se pravi e izjema je od izjeme gradiva ki so namenjena izključno pouku kar kar direktiva tudi jasno
VSOS,8.0,"» Kot pravi 14. člen ustave , so v Sloveniji vsakomur zagotovljene enake človekove pravice in temeljne svoboščine .",9.0,pri ustnih harmonikah je to kaj jaz
VSOSOV,1.0,"Če ima nekdo vse in bi bili vi zaradi tega preskrbljeni , vam povem , pri meni bi se v svojih treh vogalih krepko",0.0,0
VSOSV,11.0,"V 7270 tiči tehnologija , ki jo slovenski ponudniki mobilnih signalov še ne ponujajo .",1.0,z nami je še vedno [name:personal] [name:surname] človek ki mu mnogi pravijo tudi komik
VSOSVO,2.0,"pripovedoval mladenič , ki mu je zdravniška pomoč rešila življenje .",1.0,potrebno pač se pogovoriti z zdravnikom in nekje eee biti siguren da je to kar je zdravnik predpisal res res prava stvar na ta način mu lažje eee
VSOSVOV,1.0,"Obstaja tudi možnost , da so se nam nekatere stvari tedaj zdele popolnoma nepomembne , ko pa se jih sedaj spominjamo ,",0.0,0
VSOSVOVS,0.0,0,1.0,da smo mi že v drugem obdobju ko si pa on že zgradi prvo bivališče iz vej slame in tako naprej se pravi kaj je bil na-
VSOSVOVVOVOSVOOV,0.0,0,1.0,ne more on e s to pomočjo finančno ki jim država trenutno daje jim ne more dati toliko jim ne da toliko denarja da lahko on povrnil kompleten pridelek katerega je izgubil ne
VSOSVS,1.0,"ima SLS dva predloga , in sicer , da naj bi se porodniški dopust podaljšal za tri mesece , število otrok pa bi se",0.0,0
VSOSVSVVSOSOVOV,0.0,0,1.0,sem pa nadgradil v bistvu jaz te svoje kolumne eee v katerih predvsem oziroma izbor je bil takšen da so tu predvsem tiste ki opozarjajo na neki čas na neki trenutek in v katerih nastopajo neki ljudje eee večina ali vse v bistvu b- bo nekdo ki bo knjigo v roke vzel in jo prelistal
VSOV,45.0,"Vse več je ledu po žlebovih , ki se mu umikava v težka , včasih previsna mesta .",10.0,no pa so pa tudi konkretni ukrepi o katerih smo jih brali v eee napovedi
VSOVO,18.0,vrnila v San Antonio in Juanita mu je kuhala kavo .,0.0,0
VSOVOO,2.0,"- Ali nima vlačugar imenitnega izgovora , ko lahko naprti svoja kozlovska nagnjenja kaki zvezdi !",0.0,0
VSOVOOSV,1.0,"Ker pomeni kršenje ali samovoljno spreminjanje dogovora , ki so ga sprejeli v Moharju , razlog za napoved stavke , so jo delavci tudi napovedali , in sicer za torek , 16. januarja .",0.0,0
VSOVOOVV,1.0,"V pojasnilu ministrstva je pisalo , da je program namenjen varnostnim organom , ki » varujejo ZDA pred tistimi , ki jim mislijo škodovati « .",0.0,0
VSOVOOVVV,1.0,"mora prenovljena davčna uprava zavezancem omogočiti , da bodo lahko vse , kar od nje pričakujejo , se pravi razna potrdila , izpise in drugo , tako kot doslej dobili v enem dnevu .",0.0,0
VSOVOV,6.0,"S čestitko ob rojstvu otroka in vpisom simboličnega zneska v hranilno knjižico novorojenčka povabi Dolenjska banka starše , naj varčujejo za svojega otroka in ga že v zgodnjem otroštvu navajajo na varčevanje .",1.0,pajdaš bil so bili dober pajdaš mojemu očetu pa te so že gor prišli ka tisti to dela pa so ga iskali
VSOVOVOOV,1.0,"Tudi v takem deluje Sveti Duh in mu podarja dar ljubezni , da z njim z Božjo ljubeznijo ljubi Boga ( kolikor ga spozna ) , sebe in bližnjega .",0.0,0
VSOVOVS,1.0,"spominja priljubljeni glasbenik , ki so mu sprva povedali , da ga čaka sedem let napornega kazenskega dela .",2.0,se pravi ta logična enka na tem vhodu ta oscilator zaoscilira s to frekvenco ki jo določata dva moja elementa logična
VSOVOVSVSVVVVSVOS,1.0,"Na vprašanje , ali ne bi bilo bolje , da vlada uredbo spremeni , kot pa da jo ( vključno ali na čelu z uradom predsednika vlade ) krši , pa je Osolnikova odgovorila , da formalnopravno to sicer drži , vendar pa ocenjuje , da je bolje , da so pri napredovanju nekatere izjeme , kot pa da na splošno znižajo merila , kar vsekakor ne bi",0.0,0
VSOVOVV,1.0,"V okviru zveze bi lahko delovala skupina , ki bi potencialnim investitorjem omogočala lažjo komunikacijo z npr. kmetijskimi skladi , poskušala bi sodelovati pri sprejemanju raznih prostorskih aktov itd.",0.0,0
VSOVOVVOSSV,1.0,"O tem navsezadnje zgovorno priča v dobrega pol stoletja porabljen bilijon dolarjev , ki revščine ne le niso omilili , ampak so jo ponekod še poglobili , ker so imele od porabljenega denarja večidel koristi skorumpirane in nesposobne gospodarsko - politične kaste v slabo upravljanih in vodenih državah v razvoju , kakršnih je okrog sedemdeset .",0.0,0
VSOVOVVVV,0.0,0,1.0,veš ti si moraš sebi primerno izbrati razumeš da se s tabo stara da je pol da sta isto skupaj
VSOVS,19.0,"V Mariboru so se zbrali praktiki s tega področja , ki jih je zanimala vladna politika o vodah v Sloveniji , predvsem pa konkretni",2.0,pol sem pa j- a sem jaz nekaj menjal a je a je ati je
VSOVSV,2.0,"Torej pustiva , da vtis , ki ga je takrat name naredilo tisto lulanje na daljavo , učinkuje na naju .",0.0,0
VSOVSVO,2.0,"pravi Nastja , ki se bo novim soigralcem pridružil v ponedeljek , ko bo Austria pod taktirko trenerja Frenkieja Schinkelsa začela priprave na novo sezono .",0.0,0
VSOVSVS,2.0,"Tokrat so se vnele le smeti , tako da v požaru , ki sta ga pogasila dva gasilca , ni bilo gmotne škode .",0.0,0
VSOVV,7.0,"reševala onadva , tako da sta mi preprečevala , da bi obupal .",6.0,želi [name:personal] pa me zanima če zato da se loči od tašče
VSOVVO,4.0,"Ker zahteva promocija mobilnosti v Evropi večjo razvidnost in primerljivost stopenj , se je pokazalo kot nujno , da se oblikuje nekaj skupnih meril za strukturno definicijo stopenj master , kot že rečeno , ne glede na njihova različna nacionalna imena ( konkretne strokovne in znanstvene naslove ) .",2.0,pa ne pozabite da eee jaz nekatere štajerščine in take zadeve ne slišim tako da bo imela večja pooblastila
VSOVVOO,1.0,"Pomembno pa je poudariti , da zaščita pred neželeno zanositvijo ni zaščita pred spolno nalezljivimi boleznimi , zato ob partnerju , ki ga slabo poznate , za lastno zaščito uporabite metodo , ki je v svetu poznana kot Double Dutch : poleg hormonske kontracepcije se",0.0,0
VSOVVOOSV,1.0,"Prvi se je odzval poslušalec z Vrhnike , ki je zbranemu občinstvu oznanil , da že vse življenje je samo krvavice , pa mu nič ne manjka , čisto",0.0,0
VSOVVOOV,1.0,Takrat naj bi se bil proti njemu zagnal Robi in mu skušal iz rok iztrgati avtomobilske ključe ter ga udaril .,0.0,0
VSOVVS,0.0,0,1.0,vem kdo si je te knjige sposodil a veš to
VSOVVSO,1.0,"Ko v bližini ni bilo prodajalk , je vrečko vrgel skozi okno na ulico , kjer je čakal R. J. Trik so vseeno",0.0,0
VSOVVSS,1.0,"- ČE PRENEHA POTREBA PO DOLŽNOSTI , KI JO OPRAVLJA , ALI ČE SE ZMANJŠA STALNA SESTAVA , PA NI MOGOČA NJEGOVA RAZPOREDITEV NA DRUGO DELO .",0.0,0
VSOVVSV,1.0,"Šele ko se je pred davčnim uradom ustavila dolga kolona kraljevih avtomobilov , da bi kralja odpeljala nazaj v palačo , so spoznali , kdo je bil pravkar med njimi .",0.0,0
VSOVVSVVO,1.0,"imeli Portugalci kar 80 - odstotno posest žoge ) sta dala slutiti na pravi polom "" Zbornaje "" , a so se Rusi začuda hitro pobrali in do konca polčasa niso bili več v pretirano podrejenem položaju , vse niti pa so v svojih nogah še naprej",0.0,0
VSOVVV,3.0,"Kako bodo v tej banki ravnali po aprilu , ko bo naša največja banka provizije za položnice začela obračunavati drugače , pa bodo skupaj s Pošto Slovenije še proučili , verjetno še v",1.0,eee ta k- je rekel ta kmet ne da mu naj rečem tako da bom eee potem zdaj probal se zmeniti enkrat naslednji teden štirinajst dni
VSOVVVO,2.0,"Ko je prišel Henrik , resnično skesan , ga je pred trojnim obzidjem grofičine trdnjave pustil čakati tri dni v januarskem mrazu , čeprav je nosil samo spokorno obleko .",0.0,0
VSOVVVSS,1.0,"Če vsebuje pivo sedimentirane kvasovke , nehamo nalivati , še preden pridejo kvasovke v kozarec ( razen pri nekaterih vrstah piva , pri katerih je sediment zaželen - na primer pšenično pivo ) .",0.0,0
VSOVVVVV,1.0,"Vem namreč , da so čustva , ki so me poganjala , bila čustva , o katerih ne govorim rad : moje bojazni , moja sramežljivost , moja želja po veličini , moja želja , biti med zmagovalci pri vzdržljivostnem teku , moja želja napraviti "" prav "" , in moj strah , da bi odpovedal .",0.0,0
VSS,95.0,"V nedeljo , 23. maja , bo v Križankah v Ljubljani nastopil Julio Iglesias - Cene vstopnic za koncert se",23.0,eee potekajo pa razprave v tej smeri to to je
VSSO,3.0,Na prvem mestu so tu zagotovo bajkerji ; imigranti iz drugih subkultur jim,1.0,ko je rekla [name:personal] še jaz ga komaj
VSSOV,2.0,"tvorijo notranje primerjave - procesi , na podlagi katerih otroci samozaznave lastnih zmožnosti na področju matematike primerjajo z samozaznavami lastnih zmožnosti na področju branja .",1.0,ampak eee biti bolj dostopni mogoče in na kratko jasno povedati kaj tisto kar družbo najbolj zanima
