Word Order,Frequency_SSJ,Example_Sentence_SSJ,Frequency_SST,Example_Sentence_SST
SVVOVOV,5.0,"Polikarp se je po zločinu vrnil v Poljansko dolino in z nagrabljenim , zločinsko pridobljenim denarjem je imel priložnost pridobiti veljavo in se povzpeti na družbeni lestvici .",2.0,to je bila ena tako po- polprofesionalna lutkovna skupina ki s- mmm z predstavo kar uspeli in eee takrat sem tudi dejansko prvič videl da pa v bistvu mmm nekako eee z d- zadostnim številom predstav eee da pa se tukaj nekaj bi pa tudi finančno dalo kaj pokriti
SVVOVOVO,1.0,"Ivan skupaj z ženo Dagny živi v New Hampshiru , kjer v centru Ossipee vodi nadaljevalne tečaje » RECI - DA ! « in izobražuje nove učitelje .",0.0,0
SVVOVOVOSVVO,0.0,0,1.0,ja jaz sem pa ugotovil ko smo dobili teste od matematike nazaj in pol sem imel pač bolj slabo štirico sem pisal eee in pol mi je [name:personal] pomagal iskati točke
SVVOVOVOV,1.0,"Vse so hotele večati svoje armade , izboljševati svoje topove in opraviti vse mogoče priprave za vojno , ki bo enkrat prav gotovo prišla .",0.0,0
SVVOVOVOVVO,1.0,"» Ženska je prišla okrog pol osmih , « je povedala detektivom in uživala v občutku pomembnosti , ker so ji namenjali tolikšno pozornost , da ne govorimo o zapisnikarju , ki je zapisal vsako njeno besedo .",0.0,0
SVVOVOVS,2.0,"Prošnji bosta morali prestati vrsto preizkušenj , medtem pa je že odločeno , da bodo letos popotresno obnovili stolp na Blejskem gradu in zidove gradu Katzenstein v Begunjah , v katerem domuje Psihiatrična bolnišnica .",0.0,0
SVVOVOVSVO,0.0,0,1.0,to so pač eee kombinacija in slalom in eee če računamo da eem dodaš še eno disciplino lahko osvojiš toliko točk kot jih je ona je pa zares eee vsestranska v formi od štarta do cilja od začetka sezone do konca sezone in imam same pohvale zanjo
SVVOVOVVO,2.0,"V tem času se lososi ustalijo na enem kraju , izgubijo značilno srebrno in dobijo bakreno rdečo barvo , shujšajo in izgubijo mišično moč .",0.0,0
SVVOVOVVOOV,1.0,"Avgust je skušal uvesti dedno pravico do prestola , da bi preprečil prihodnje spore , vendar je moral pozneje za naslednika imenovati pastorka Tiberija , ki ga ni imel rad .",0.0,0
SVVOVOVVOSVSOVVOOVVVO,1.0,"Avstrijski položaj je takle : za nobeno ceno ne more sprejeti ruskega prodora na spodnjo Donavo , boji pa se vojne z Rusijo , v kateri bi morala nositi glavno težo , fronto v Galiciji , medtem ko bi Prusija počela v Nemčiji , kar bi se ji zahotelo ; na drugi strani pa se spet boji , da bi si Francijo naredila za sovražnika , kajti proti francoski volji ne bi mogla obdržati svoje oblasti v Severni Italiji .",0.0,0
SVVOVOVVOVO,1.0,"Pri pouku NIT v 4. razredu učenci spoznajo in uporabijo postopke za obdelavo lesa , berejo načrt , razvijajo in urijo delovne spretnosti ter upoštevajo pravila varnega dela .",0.0,0
SVVOVOVVV,1.0,"Najrevnejše množice Romov živijo na severovzhodu , v okolici Miskolca in Ózda , nimajo dela , prav tako ne kaže , da ga bodo kaj kmalu dobili , med brezposelnimi bodo med zadnjimi , ki se bodo zaposlili .",0.0,0
SVVOVS,5.0,"Informacija je tu , zdaj pa čakamo , kaj bodo pokazali specializirani muzeji .",0.0,0
SVVOVSOV,2.0,"Velike klinične raziskave so namreč dokazale , da tako lahko zelo učinkovito zmanjšamo nevarnost , da bi nastali zapleti , ki sem jih omenil in ki so za bolnika lahko tudi usodni .",0.0,0
SVVOVSOVO,1.0,"To se utegne končati s tem , da boste večer preživljali v samoti , ona pa si bo morda iskal utehe drugje - ne vselej v moški družbi .",0.0,0
SVVOVSOVSOV,1.0,"Prababica Olga , ki si je prišla pogledat svojo vnukinjo , je postala nostalgična : To me spominja na moj maturantski ples , glasba in četvorka sta me popeljali v moja najstniška leta .",0.0,0
SVVOVSOVV,1.0,"Renton se skremži , ko v daljavi zagleda Sikboja in pomisli , kakšne bedarije mu morajo trenutno prihajati iz ust .",0.0,0
SVVOVSOVVSSSVS,0.0,0,1.0,zdaj mi se srečujemo tulele s predlogi vlade ne ker prinese izračune na dve decimalki tu pa fali v grobem ne na na na številke kar se mi zdi ne da če je šlo to čez toliko rok in čez tako pomemben resor kot so finance in na koncu vlada da je to da to škandalozno da se naredi napaka
SVVOVSOVVSVVO,1.0,"Potovalni stroški bodo majhni , je pa res , da smo v prvo vrsto takoj postavili organizacijo tekme , saj dobro vemo , kakšni so odnosi navijačev obeh klubov , "" je po žrebu , ki se ga je udeležil skupaj s članom sanacijske komisije Mitjo Hlastecem , dejal sekretar Maribora Pivovarne Laško Uroš Jurišič in nadaljeval : "" Doma pričakujemo razprodan štadion .",0.0,0
SVVOVSSVO,0.0,0,1.0,ampak na kaj smo pa mi ponosni ne je pa na to da smo v BTC Cityju tudi izobraževali ne samo trgovce ampak tudi stranke ne ni- niso samo najmlajši tudi starejši so se posluževali tega ne
SVVOVSV,3.0,"Vojne ni , vendar je zelo težko najti Srba , ki dvomi , da bo v njej Srbija zmagala .",2.0,naslednjih pet je finansirano petinosemdeset procentov in ne govoriti da j da gre za sto procentno financiranje tako ali drugače ker materialne stroške mora šola zagotavljati sama
SVVOVSVO,2.0,"Evroposlanci so , denimo , zavrnili amandma treh poslancev iz skupine zelenih , ki so se zavzeli , da Slovenija med pristopanjem k Uniji lahko ohrani sklenjene prostotrgovinske sporazume s Hrvaško , BiH in Makedonijo .",0.0,0
SVVOVSVOVSV,1.0,"Ljudje , o katerih vedo , da so dojemljivi za tak način dokazovanja , so tedaj pripravljeni odobriti tvegane rešitve , saj izhajajo iz prepričanja , da druga stran nima le napačnih pravnih izhodišč , temveč da tam vladajo tudi poniglavost , neupravičena domišljavost in ošabnost , in tako naj bi bilo že od nekdaj .",0.0,0
SVVOVSVSOV,0.0,0,1.0,ker na primer Bukvarna se dejansko ukvarja predvsem z ne preprodajo knjig no ampak e prodajajo te rabljene knjige ne in bom rekel to je že bom rekel kaj se kulturnega kapitala tiče zelo velik plus ne
SVVOVSVSOVO,1.0,"Pearl je sedela na koncu pomola in uživala ob slastnih grižljajih ribe , ki jo je našla , Frances se je vrnila v San Antonio in Juanita mu je kuhala kavo .",0.0,0
SVVOVSVSV,1.0,"Uspešna lanska sezona potrjuje , da imajo v podjetju prave programe in da obstaja velika perspektiva v turistični dejavnosti na tem območju , pravi Seljak , ki je na krmilu že enajsto leto .",0.0,0
SVVOVSVSVVSVVSVSVV,0.0,0,1.0,je nižja frekvenca ampak ampak ta Dopplerjev efekt se lahko uporabi tudi zato da se meri ne takšne stvari kot recimo da se vesolje širi ne da se vesolje širi ampak zd- zdaj potem je pa tukaj je napi- e to je zanimivo da so šli ugotavljat kaj je res ne ali se vesolje ali se hitrost tega širjenja toliko tako kot so bili prepričani dolga leta ali se hitrost širjenja manjša ali povečuje ali je konstantna
SVVOVSVVO,0.0,0,1.0,to pomeni da določimo neko zavarovalno vsoto do katere želimo da na va- zavarovalnica krije eee krije škodo
SVVOVSVVVS,1.0,"Peel ni želel vladati pod omejitvami , ki jih je vsilila kraljica , zato je odstopil s položaja in pustil , da se je na oblast vrnil Melbourne .",0.0,0
SVVOVV,7.0,"Njegov ostri , analitični razum zna razvozlati še tako zapleten problem , zato zna odlično upravljati z denarjem .",5.0,ministrstvo sindikat računsko sodišče ravnatelji to je po mnenju učitelja [name:personal] [name:surname] seznam tistih ki bi za nezakonito izplačane plače morali prevzeti odgovornost pa kot pravi niso
SVVOVVO,3.0,"Dekle je ob vzvratni vožnji začelo vpiti , da bi jo utišal , sem prijel nož .",1.0,pojem svobode od druge polovice osemnajstega stoletja ni opisoval ali ni več opisoval eem samo statusa posameznika eem svobodnjaka oziroma tlačana zapornika ali človeka na prostosti temveč je začel predstavljati bolj kompleksna stanja
SVVOVVOO,0.0,0,1.0,ja najlepša hvala za vprašanje jaz bom vendarle uvodoma izkoristil e in na tem mestu čestital ekipi Eli Pos za lansiranje res e uporabnega produkta in storitve za katerega verjamemo da bo olajšala poslovanje marsikateremu e malemu obrtniku in podjetniku
SVVOVVOOV,1.0,"Država potemtakem mora uvesti nove davke , če hoče ohraniti zatečeno stanje , ali pa zaposlene v javnem sektorju odpuščati .",0.0,0
SVVOVVOOVVO,0.0,0,1.0,rečeno je samo to da danes in v prihodnjih dneh ne bi želel reči nič ali ravnati tako da bi zapravil možnost da mi uspe sestaviti močno in kompetentno vlado
SVVOVVOSOV,1.0,"Množica pa je ob obsodbi hotela videti mučenje in krvavo zadoščenje , saj se je malokrat zgodilo , da so odkrili čarovnico in naivno ljudstvo je to z veseljem sprejelo .",0.0,0
SVVOVVOSSSVO,1.0,"Čisto na začetku naj bi vesolje obstajalo kot nekakšna brezobličnost , apejron , potem pa naj bi se razvilo v nasprotje med nečim , kar so imenovali eros in naj bi predstavljalo prijazno urejenost svetovij , ljubezen med njimi ter kaos , kar naj bi bilo sovražni nered , zmešnjava in nasilje ; vse , kar poslej nastaja živega in mrtvega , je podrejeno tej dvojnosti .",0.0,0
SVVOVVOV,1.0,"Agentka ni prav dobro razmislila in je rekla : » Seveda , Susan bom prosila , naj spremeni nekaj besed , pa bo . «",0.0,0
SVVOVVOVVOV,0.0,0,1.0,eee sprva je sprva je bila mišljena sicer eee mladinska kulturna produkcija v Mariboru ker sem sem mislil zajeti eee celoten Maribor celotno njegovo kulturno produkcijo ampak žal bom rekel zaradi časovne omejitve pa tudi bom rekel lastnih nekih zmožnosti pač tega trenutno še nisem sposoben narediti zato ker bi mogel vseeno malo preveč podatkov zbrati
SVVOVVOVVSVVO,1.0,"Toda že dejstvo , da so šteli za potrebno , ovekovečati svoje zaobljube bogovom z napisano besedo , da so želeli ohraniti spomin na kar moč dosti ljudi in dejanj z javno razstavljeno zapisano besedo , je vendarle tako mogočna sprememba v miselnosti in v okolju , da dejansko moramo domnevati da je bila sposobnost brati in razumeti latinski jezik zelo razširjena .",0.0,0
SVVOVVSV,1.0,"Če pa bo slovenska država želela tudi v prihodnje dosegati z domsko vzgojo dobre rezultate , bo morala , kot pravi sedanji direktor doma Marjan Grahut , več vlagati v bivalne razmere in sodobnejšo tehnologijo .",0.0,0
SVVOVVV,1.0,"Tako na primer 35 odstotkov zaposlenih trdi , da nimajo vpliva na svoj razpored nalog , in 55 odstotkov , da ne morejo vplivati na to , kako dolgo bodo delali .",1.0,jaz sem že ničkolikokrat opozarjala da pošiljamo slovenske vojake na mednarodno misijo ne delajo v dobro države pa ne morejo voliti
SVVOVVVO,1.0,"Tudi jaz sem se podil po trgcu : snemal sem turiste , ki so hodili po granitnih ploščah , svojega brata Charlesa , nekaj mulcev , ki so se kotalkali , plesalca , ki je oponašal robota .",0.0,0
SVVOVVVOV,1.0,"Fant je bil prehiter in ni mogel pravočasno zavreti , tako da je domačinko zadel in zbil , potem pa še sam izgubil ravnotežje in skupaj s sopotnikom padel .",0.0,0
SVVOVVVVV,1.0,"Če se Zemlja vrti okoli lastne osi in hkrati kroži okoli Sonca , bi to vsekakor morali opaziti , podobno kot ni mogoče spregledati , da se vozimo recimo na vozu .",0.0,0
SVVOVVVVVSVO,0.0,0,1.0,no ampak eee zdaj so znanstveniki dokazali pazite to da testosteronski obliži ki se dajo kot kaže kupiti nisem vedel ne rabim testosteronski obliži spodbudijo željo po seksu pri ženskah
SVVS,70.0,"Djordje Žebeljan , državni podsekretar za energetiko , je po sestanku razložil , da so se pogovarjali o več različicah , saj status JE Krško v prihodnjem letu še ni dokončno opredeljen .",11.0,na glavnik oni špila [name:surname] ja tam je [name:surname]
SVVSO,5.0,"Hailun je rekel , da ima Yušien svoj tovor že pri sebi .",2.0,zdaj jaz verjamem da ima vsak svojo zgodbo
SVVSOOV,1.0,"Prvi višek rokometnega dneva v Rdeči dvorani bo ob 14.30 , ko se bosta pomerili ženska reprezentanca Slovenije in selekcija tujk , ki si rokometni kruh služijo na sončni strani Alp .",0.0,0
SVVSOOVV,1.0,"Nekatere raziskave kažejo , da imajo debeli ljudje manjšo možnost , da jih zaposlijo in da je tudi manj verjetno , da bodo napredovali .",0.0,0
SVVSOOVVSVOOSVSOVOSS,0.0,0,1.0,e drugo kar je e upošteval je tudi naš pripravljalec zakona e to da se iste izjeme izvzame se pravi e izjema je od izjeme gradiva ki so namenjena izključno pouku kar kar direktiva tudi jasno predvideva e to nam tudi nudi možnost da tam kjer so licence že prisotne to je tako imenovani licence over right
SVVSOS,1.0,"Sredstva bodo sicer prispela na neki sklad , do katerega ima organizacijski komite dostop , saj je neposredna pomoč organizatorjem po italijanskih zakonih prepovedana .",0.0,0
SVVSOSV,2.0,"Te spomladi kalijo , iz njih nastanejo bazidiospore , ki jih veter prenese na hruške .",0.0,0
SVVSOSVO,1.0,"Razlogi za veselje se od zgodnjega otroštva do mladostništva spreminjajo , saj se spreminjajo tudi pomeni , ki jih posamezniki pripisujejo določenemu dogajanju .",0.0,0
SVVSOSVVOV,0.0,0,1.0,v kolikor pa le-ta opazi da eee so se morebiti pojavili stranski učinki zdravila ki jih bolnik ni prepoznal oziroma ni zavedel pri pregledu v ambulanti takoj izbranega zdravnika oziroma lečečega zdravnika o tem obvesti
SVVSOV,2.0,"» Ne , jaz bom , « je odvrnil Victor in Boja previdno odložil v naslanjač ob vhodnih vratih .",2.0,medtem ko pa ta razlika začne naraščati pa ta upad ni več tako izrazit neke sorte plato dobimo
SVVSOVOV,1.0,"Fran je sočutno zrla v Philipa Matthewsa in se spomnila , da je bil prvi vtis , ki ga je dobila o njem , ko ga je zagledala ob vratih zapora , njegovo zaščitniško vedenje do Molly .",0.0,0
SVVSOVOVSV,1.0,"Poleg tega so policisti vedeli , da ima blondinka poškodovano ramo , imeli so krvne sledi iz notranjosti vozila , predvsem pa je bil tu še krvav odtis dlani z jasnimi papilarnimi linijami , ki je ostal na sprednjem delu avtomobila .",0.0,0
SVVSOVSSVO,1.0,"Screening bo pokazala , kje smo na poti v EU , kaj mu sledi in ali je leto 2002 še vedno tisto , ko naj bi Slovenija dosegla polnopravno članstvo v novi širši domovini ?",0.0,0
SVVSOVSVO,1.0,"Na vprašanje o oškodovanjih družbenega premoženja je Kocijančič odgovoril , da je bilo dejanskega oškodovanja le za desetino od tistega , kar je ugotavljala agencija za plačilni promet , ki je marsikje ustavila lastninjenje .",0.0,0
SVVSOVV,2.0,"Vitka Ribičič je postregla s kratkim , a jasnim odgovorom , da je bilo k sreči takega nasilja doslej malo , da pa se ga bodo očitno morali na centru lotiti .",0.0,0
SVVSOVVOVVOVOVS,1.0,"Odgovor : Stvarnopravni zakonik določa , da ima lastnik nepremičnine pravico odstraniti in si prilastiti veje sosedovega drevesa , ki segajo v zračni prostor njegove nepremičnine , in korenine , ki rastejo v njegovo nepremičnino , če ga motijo in če tega na njegov poziv ne stori lastnik sosednje nepremičnine .",0.0,0
SVVSOVVS,1.0,"Potem ko se je prva petletka uspešno zaključila z lansiranjem modela , kot je Frankie Knuckles , ki je svoje acid funk onostranstvo razmastil po akutno plesočem odru , bo letos še bolj vroče , saj bodo v akciji ljubezen , groove in verjetno tudi sex pod poskočno taktirko legende z imenom Danny Rampling .",0.0,0
SVVSOVVSV,0.0,0,1.0,eee in k- potem je letalo strmoglavilo in potem so prišli Afganistanci da ju da jih rešijo ampak je bilo na žalost so že vsi umrli
SVVSOVVVO,0.0,0,1.0,tako da jaz sem pač nehal ke tudi ke gre dosti denarja za to pa pa tako no preveč energije sem v to dajal sem se hotel raje posvetiti muziki pa
SVVSS,2.0,"Ker se ovulacija zgodi , še preden ' pride ' menstruacija , je odsotnost menstruacije nezanesljiva metoda kontracepcije .",1.0,ker ko sem jaz noter vstopila pa je rekla [name:personal] no vidve to pa je ta pa ta
SVVSSO,1.0,"Prednost kompatibilnostnega pred načinom » legacy « je predvsem v uporabi vseh 4 GB pomnilnika za namen določenega procesa ( pri 32 - bitnih aplikacijah obstaja 2 GB omejitev , preostala 2 GB pa sta namenjena operacijskemu sistemu ) .",0.0,0
SVVSSSVO,1.0,"Žbogar je ves čas zatrjeval , da sta se v njegovem zakonu cedila mleko in med , da v desetih letih družina ni bila niti enkrat sprta , žena pa je namesto raja opisovala pekel .",0.0,0
SVVSSV,5.0,"Na gradu Borl pri Ptuju je glasba počasi odzvenela , iztekle so se umetniške delavnice in otroški živžav se je polegel .",2.0,eem jaz se bolj osredotočam na tele mariborske žurke ker počasi bo Cvičkarija pa Lampijončki se tudi bližajo
SVVSSVO,6.0,"Udeleženci so ugotovili , da so tako na ravni bachelor kot na ravni master različne pobude in usmeritve , naravnane k definiranju učnih izidov in kompetenc , pa tudi , da bo ta različnost na eni strani omogočala kapitaliziranje bogastva evropskih visokošolskih tradicij , na drugi pa oblikovanje ' evropskih profilov ' v različnih disciplinah .",1.0,midva z Dimom se pravi z Dimitrijem Ruplom sva bila pa najbolj izpostavljena v tistem času ko je izšla sedeminpetdeseta številka Nove revije in to je vzbudilo v celi Jugoslaviji cel cirkus
SVVSSVOVOSVVSVO,1.0,"Novinarka s sladoledasto rumenim mikrofonom je sladko žuborela , da so ali pa niso resnične trditve , po katerih je slovenska vojska z nakupom orožja v bližnjevzhodnih državah kršila brionski moratorij , in napovedala kontaktno oddajo , v kateri bodo poslušalci odgovarjali na vprašanje : » Zakaj menite , da jastogovo mesto povzroča raka ? «",0.0,0
SVVSSVS,1.0,"» To pomeni , da ni več ovir za začetek njegove temeljite obnove , kar doslej zaradi vloženega denacionalizacijskega zahtevka ni bilo mogoče , « je na včerajšnji tiskovni konferenci povedala županja Vika Potočnik .",1.0,jaz mislim da je tole punce jaz mislim da je tole to
SVVSSVV,1.0,"Splošna težnja , v katero se , tako vse kaže , vključujemo pod krinko "" vključevanja v Evropo "" , je tale : tako imenovana "" izvršna oblast "" se vse bolj odmika od nadzora javnosti , izmika se celo spod nadzora predstavniških političnih teles .",1.0,tako ja meter je koliko je meter meter je tam okoli štiriindvajset devetindevetdeset ne ali koliko je
SVVSSVVO,1.0,"Vsaka dirka se začne z ogrevalnim krogom , sledi predstavitev dirkalnikov , njihovih lastnikov in voznikov , potem pa rdeče - modro - beli Union Jack ( državna zastava združenega kraljestva ) pomaha in spustil nestrpne tekmovalce v boj za lovoriko .",0.0,0
SVVSSVVS,2.0,"Njen predsednik John Howett je potrdil , da so pogajanja v teku , da pa sodelovanje v prihodnjem letu še ne pride v poštev , saj je premalo časa za reorganizacijo .",0.0,0
SVVSSVVSV,1.0,"Mama ni vedela , kako naj dokaže , da je bila njena hčerkica žrtev spolne zlorabe , kajti deklica sama ni znala povedati , kaj se je dogajalo .",0.0,0
SVVSV,14.0,"Vrednost odkupljenih paketov delnic znaša 68,6 milijarde tolarjev , neizkoriščenih pa ostaja 73,3 milijarde tolarjev certifikatov pooblaščenih investicijskih družb , so sporočili iz združenja družb za upravljanje investicijskih skladov .",11.0,in v nekem določenem trenutku so se zakoni nekako sprostili in so rekli aha kamioni se pa lahko uvažajo
SVVSVO,8.0,"Profesor Myer je poudaril , da je zelo pomembno , da bi morale države podpisnice konvencije upoštevati vse evropske minimalne standarde in hkrati tudi tradicijo .",4.0,jaz arki ne smela jesti jaz imam domala že sto kil
SVVSVOO,1.0,"New York Times poudarja , da bi utegnil omenjeni predlog povzročiti razhajanja med tistimi republikanci , ki so naklonjeni krepitvi ameriške vojaške moči , in zagovorniki "" večje discipline "" na področju proračuna .",0.0,0
SVVSVOOSV,1.0,"Direktor Loškega muzeja je dodal , da je na loškem gradu 24 razstavnih dvoran , da pa žal nimajo v njih čuvajev in ne videosistema , kar so tatovi očitno vedeli .",0.0,0
SVVSVOOV,1.0,"In medtem ko je ladja drsela skozi neskončno zelenino papirusa in plavajočih hijacint , iz katere se je morda enkrat na dan kot privid prikazal deblak z golim veslačem , sem se v mislih zahvaljevala vsem tistim , ki so me napotili v Sudan .",0.0,0
SVVSVOOVO,1.0,"Mesto je vzdržalo 18 dni in ko je padlo , je Viljem tam zgradil grad , da bi si zagotovil nadzor .",0.0,0
SVVSVOSV,0.0,0,1.0,si ti lahko misliš veš ker to otrok ne premišlja ker te teža naprej potegne ne
SVVSVOV,4.0,"ZAKON JE IZRECNO DOLOČAL , DA DRŽAVNI USLUŽBENEC NE SME BITI , KDOR JAVNO IZRAŽA NAČELA ZOPER OBSTOJEČO DRŽAVNO UREDITEV ALI SE ZAVZEMA ZA PROTIPRAVNE SPREMEMBE DRŽAVNEGA REDA .",1.0,naši pa ne bojo mogli iti zato ker je [name:personal] je bil na operaciji saj sem ti povedala ne
SVVSVOVO,1.0,"Obrtna zbornica pri tem noče biti in ne bo razsodnik , saj je prepričana , da bo trg naredil svoje in » pokopal « sejemske prireditve brez vsebine in obiskovalcev .",0.0,0
SVVSVOVOVOSVVO,0.0,0,1.0,in če bo kdo rekel da ni finančnih sredstev za to da dvignemo ne samo minimalne plače minimalne pokojnine ampak da naredimo sistem tisti sistem ki bo omogočal ponosno življenje vsakega slehernega izmed nas potem ta laže ali ne pozna proračuna Republike Slovenije
SVVSVOVV,2.0,"Naša hipoteza je namreč , da Kajn ni ubijal iz ljubosumja , ker v božjem pogledu ni bil izbran , marveč zato , ker je vedel , da bog ve , da se ga je želel znebiti .",0.0,0
SVVSVOVVS,0.0,0,1.0,ja ne to je t- na vem kako je to ne ne vem po moje je mišljeno drugače da ne samo da njej ni zavgalo ker je bilo toliko smeti
SVVSVOVVVVVOVOVOSVVOOVVSVVVO,1.0,"Ker poslanci Združene liste in Liberalnih demokratov nočete , da bi na tej seji sodeloval tudi predsednik Vlade - zgleda , da ga nočete poslušati - sem se vendarle odločil , da se oglasim in povem tisto , ker pač moramo vse povedati , kar kdo ve , da bi morda zbrali skupaj nekaj , kar bi bilo lahko tudi blizu resnici , če namreč nočemo , večina noče dobiti ali zahtevati ustreznih informacij pred odločanjem .",0.0,0
SVVSVS,8.0,"Kdor veruje vame , bodo , kakor pravi Pismo , iz njegovega osrčja tekle reke žive vode . «",2.0,celovita posodobitev sodobnih knjižnojezikovnih standardov ni preprosta naloga še zlasti če se zavedamo da v slovenščini letno izide okoli pet tisoč knjižno knjižnih publikacij ki so najbrž jezikovno pregledane da se dnevno s tiskanimi časnikarskimi viri srečuje skoraj pol milijona bralcev
SVVSVSOOVVOVV,0.0,0,1.0,otroka ta starejša dva sta se imela doma tako lepo da sta potem nazaj v šolo težko šla ko so se šole odprle kar mi je po eni strani kar mi godi po drugi strani pa vem da jima očitno čisto preveč nudim in čisto preveč dam
SVVSVSOV,1.0,"Odvetnik stanovalcev Jože Kristan je potrdil , da je zadeva v rokah sodišča , in dejal , da bodo stanovalci dolgove za elektriko in druge stroške poravnali .",0.0,0
SVVSVSOVO,0.0,0,1.0,tale druga vrsta a ne kaže na to kako so tale sedi in ta mu iz ene posode toči pijačo
SVVSVSS,1.0,"Rastoča inflacija , proračunska luknja in vladno letalo so verjetno samo uvod v tehtanje ustreznosti predsedniškega kandidata , vsekakor pa je pričakovati , da bo doslej zedinjena zgodba o Drnovškovem in slovenskem uspehu z njegovim odhodom s premierskega položaja in do volitev razpadla na dve zgodbi , kjer bo slovenska še naprej uspešna , Drnovškova pa morda vse bolj neuspešna .",0.0,0
SVVSVSV,2.0,"Rupel je tudi dejal , da je v ZDA , zlasti v zunanjem ministrstvu , vse do konca 90. let živela ideja o tem , kako lepo bi bilo , če bi Jugoslavija ostala skupaj .",2.0,te proge gor recimo eee sedežnice vlečnice pa to vse je recimo šest petnajst trinajst in ob in proga je recimo rdeča narisana pač rdeča srednje težka ali pa modra pa je številka sedem ali pa ta je devet ali pa ne vem koliko
SVVSVSVO,1.0,"Tudi sama še pomislila nisem na ljudi in zveri v Srebrenici - prav je , da ljudje na festivalih ne razmišljamo o žalostnih rečeh - dokler ni na velikem odru Marta Sebestyan zapela srbske ljudske poročne pesmice .",0.0,0
SVVSVSVS,1.0,"V novi 22.a ) tezi ali kasneje členu pa bi se besedilo glasilo : "" Z denarno kaznijo najmanj 5.000 tolarjev se kaznuje posameznik , če kadi v javnem prostoru , kjer je kajenje prepovedano ali kadi v delovnih prostorih , kjer to ni dovoljeno .",0.0,0
SVVSVSVSVV,0.0,0,1.0,jaz razumem menjajo se ljudje menjajo se ministri ampak poglejte otroci pa rastejo se razvijajo tukaj in zdaj
SVVSVSVV,0.0,0,1.0,te zdravniške komisije delujejo po večjih krajih v Sloveniji e v zdravstvenih domovih recimo v Mariboru e Ljubljani Kopru e potem pa tudi na Univerzitetnem kliničnem centru na Pediatrični kliniki e to primarna stopnja in potem e je še ena zdravniška komisija e ki deluje na sekundarni stopnji ki je tudi na Pediatrični e kliniki
SVVSVSVVVOVOS,0.0,0,1.0,če kdo od vas že bil morda v Egiptu [name:personal] vem da si ti bil ne če je kdo bil morda v Turčiji Grčiji Tuniziji na dopustu veste imajo čas oziroma vzamejo si čas tamkajšnji prebivalci
SVVSVV,4.0,"Slovensko plinovodno omrežje je v lasti Geoplina ; kako pa boste kot javna gospodarska služba ravnali v primeru konkurence , ko se bodo porabniki plina denimo odločili za druge dobavitelje ?",6.0,ja eee pol je še pa en drug [name:personal] bil ne vem a tisti še lani bil na srečanju ali ni bil
SVVSVVO,2.0,"Vloga storitvenih dejavnosti v okviru gospodarstva se krepi , s tem pa postaja tudi problematika kakovosti pri storitvah vse bolj aktualna , ker v veliki meri vpliva na uspešnost in učinkovitost poslovanja organizacij , ki izvajajo storitvene dejavnosti .",0.0,0
SVVSVVOVO,1.0,"Da sovražniki ne bi mogli vstopati v cerkev na konjih , da roparji ne bi mogli v cerkev potisniti vozov , na katere bi tam nalagali dragocenosti …",0.0,0
SVVSVVS,2.0,"Stara mama hoče reči , da dež pojenjuje in da ne bo toče .",0.0,0
SVVSVVSOOVSVVO,0.0,0,1.0,eee Zdaj tulele je gospod Polnar povedal ne da ne bo to da bodo dobile da bi imeli družine ali pa posamezniki večji ostanek ne dohodka kot pred eee po tem našem predlogu kot bi ga imeli po vladnem ne to pomeni da bi imeli nekaj več denarja ne vsak mesec in na koncu leta približno v povprečju tristo tristo petdeset evrov več
