Word Order,Frequency_SSJ,Example_Sentence_SSJ,Frequency_SST,Example_Sentence_SST
SSOSVOS,1.0,"Tožnica je bila pred odpovedjo pogodbe o zaposlitvi seznanjena z mnenjem invalidske komisije , da je delovno mesto , za katero ji je delodajalec ponudil novo pogodbo o zaposlitvi , ustrezno glede na njeno delovno zmožnost , tožnica pa se je že prej lahko",0.0,0
SSOSVOV,1.0,"2 Ker je tema obravnavanja začrtana s strankinimi trditvami , je za odločanje upoštevno zgolj to , kar je stranka trdila , ne pa tudi , kar je ( kot dokazno sredstvo ) izpovedala zunaj svojih trditev (",0.0,0
SSOV,7.0,"21. - Novi zakon o varnosti v cestnem prometu je poleg številnih novosti ( nekateri so jih že občutili "" na denarnici "" )",2.0,midva študenta in si midva pač tisto izmeno razdeliva najino tedensko
SSOVO,0.0,0,1.0,eee to je to je tukaj je zelo zelo pomembno da se zdravnika posluša da se ga
SSOVOOVOVOOV,0.0,0,1.0,in to je v bistvu to tako da lindy hop je tako ki ki ti da največ kreativnosti ki ti da največ eem neke svobode pri izražanju in tudi dopušča največ napak da temu tako rečem
SSOVOVV,1.0,"Največja razlika je razlika v jeziku čeprav vsi jeziki vse povedo o človeku in svetu , torej vse , kar je mogoče povedati in zamolčati .",0.0,0
SSOVOVVOVVO,1.0,"Pri tem je vzgojiteljevo zaupanje , da bo otrok tega sposoben , bistvenega pomena , saj se je le tako sposoben odpovedati svoji moči in avtoriteti , da o vsem odloča sam , in povabiti otroke , da odločajo , pa tudi da sprejemajo odgovornost .",0.0,0
SSOVOVVVOS,0.0,0,1.0,eee seveda so to za nas hude obremenitve tako da vsa vsa te ta porast okužb eee nam ne predstavlja nekega res zadovoljstva ampak eee glejte eee trudimo se po svojih eee najboljših močeh in eee naj povem to da na teh štiriintridesetih covidnih postelj znotraj dveh oddelkov vzpostavljenih dveh oddelkov eee se n- da tu postelje so praktično kar med trideset in štirideset so ves čas polne vsaj v zadnjem obdobju
SSOVSVO,1.0,"Z viniškega mosta , katerega ograja je pobarvana z dvema barvama , da je že od daleč očitna meja med dvema državama , nam je pomahal policist in že smo spuščali čoln čez prvi hrvaški jez v Pribanjcih .",0.0,0
SSOVV,1.0,"In ali je zato krivo nepopustljivo prijateljstvo nedoločeno razmerje med parlamentarno komisijo in policijo , ali pa je kdo vprašanje poskušal zlorabiti za politične interese .",0.0,0
SSOVVOVO,1.0,"Če je jama globlja od petih metrov , narava , tudi če se jo zasuje , potrebuje kar pet do deset let , da ponovno vzpostavi naravno ravnovesje ,",0.0,0
SSOVVS,1.0,"Bojazen , da bo velikan iz Redmonda različico programa za Mace preprosto opustil , se ni uresničila ( Microsoft",0.0,0
SSS,2.0,"Natura 2000 je evropski projekt , katerega namen je ohranjanje biotske raznovrstnosti , vzpostavljanje takšnih območij pa je mednarodna",2.0,no uuu vsi roki so eee vsi roki so praktično bili lovljeni proti koncu in t- to je po moje eee malo napaka zdaj
SSSV,3.0,"Če je povpraševanje po delovni sili veliko ali ponudba majhna , se bo mezda povečala .",1.0,ma ja samo so vse samo vse kar je so je cuker
SSSVO,1.0,"Družba , v kateri ni zajamčeno varstvo pravic in v kateri ni določena delitev oblasti , nima ustave .",1.0,eee tisto kar je pa pomembno je pa to da si lioni eee delimo isto poslanstvo in ista etična načela
SSSVOVVO,0.0,0,1.0,in e sicer e katere vrste bolezni e so e prepoznane za dodatek oziroma tudi za različne višine dodatka je določeno v pravilniku in na podlagi tega potem Center za socialno delo ne odloča sam ampak e te e to dokumentacijo se pravi zdravniško dokumentacijo pošlje zdravniški komisiji prve stopnje
SSSVVOSV,1.0,"Druga stran , zelo skromna manjšina , je nad njimi navdušena , pa čeprav so tipke premajhne , telefon ne zna pošiljati faksa , stvar je velika in ne gre v žep , kot telefon pa",0.0,0
SSV,42.0,"Seveda je prvi pogoj za uspeh točen met , oziroma met na mesto , kjer ščuka dejansko je .",11.0,trenutni slovensko ameriški odnosi so kakšni in kakšni so lahko v bodoče če bo Obama in bo vladal v Beli hiši
SSVO,23.0,"Mobilni operaterji , ki so za proizvajalce mobilnih telefonov glavni vir zaslužka , so nekoliko manj navdušeni nad idejo , da bi kupci kupovali glasbene datoteke pri Applu , Sonyju …",5.0,ta dolg je delno posledica tega da so banke eee seveda spremljale ta razvoj
SSVOOOOV,0.0,0,1.0,to so pa in to so vse so mi vse so mi naredile
SSVOOOV,1.0,"Celo človeštvo je rezultat neštetih fukov - in jaz , Klaus z naslovnice , mladi znanstvenik , ki se je vsak dan bolj bližal njemu določeni Nobelovi nagradi , ni ničesar vedel o tem !",0.0,0
SSVOOV,4.0,"Hkrati je osnutek zasnovan tako , da bi lahko Bush čim bolje izkoristil prednost , ki jo ima zaradi izredno uspešnega zbiranja finančne podpore ,",0.0,0
SSVOOVS,1.0,"Nasploh je v različnih inštalacijah najbolj prepoznavno kiparstvo , medtem ko slika ob koncu tisočletja poleg projicirane virtualne realnosti povzema sintetetizirano podobo , ki jo skupaj ustvarjajo tako tradicionalni slikarski postopki kot izkušnje fotografije , tiska in neonske svetlobe .",0.0,0
SSVOOVV,1.0,"Slovesi so bili v obojih primerih težki , toda Ali še ni srečala čarodejke , ki se ne bi hotela rešiti .",0.0,0
SSVOS,3.0,V kolikor so dogodki opisani kronološko in kar se tiče imen in naslovov iger ter navajanje raznih datumov je bilo to potrebno zaradi časovne orientacije .,0.0,0
SSVOSSVV,1.0,"Srbski jezik je res poseben jezik , pri katerem se drugi najprej naučijo kletvic , toda to je jezik v katerem človek ne more pošteno molčati .",0.0,0
SSVOSV,1.0,"Pohvalno je tudi to , da je Nokia v paket priložila polnilnik , ki ga v nekaterih prejšnjih paketih ni bilo .",0.0,0
SSVOSVOVO,1.0,"Hill - Odprte so vse možnosti , da bo na vseh štirih letošnjih največjih turnirjih v golfu , tako imenovanih majorjih , kateri izmed igralcev slavil svoj prvenec , toda dvakratni zmagovalec prvenstva PGA Tiger Woods bo storil vse , da prihodnji teden v Oak Hillu prepreči takšen scenarij .",0.0,0
SSVOSVVSS,0.0,0,1.0,a je pa jaz jaz sem včeraj jaz sem sicer malo zafrknil se vse skupaj ali jaz sem mislil da je to peto nedeljo po veliki noči to srečanje da da
SSVOV,8.0,"Prečenje je torej manever , pri katerem jadrnica zamenja uzde tako , da najprej zavije proti vetru .",3.0,vseeno kam bo ta denar namenu sicer se lahko vi ne ki imate tako radi eee javne finance in vsi v koaliciji se dodatno še solidarnostno odpoveste ne po tristo ali pa ali petsto
SSVOVO,10.0,"Misel , da se Cornelia II ne ziblje več ošabno na vodi , mu je pognala prijeten , skoraj čuten drget po telesu .",0.0,0
SSVOVOVO,1.0,"člen Uporabniki ob prodaji blaga končnemu potrošniku v primeru , da ta ob nakupu blaga ne vrne prazne embalaže , zaračunajo kavcijsko vrednost vračljive embalaže , ki vključuje tudi veljavno stopnjo DDV .",0.0,0
SSVOVOVOOVS,1.0,"Vaba , ob kateri ušate čisto ponorijo , je tudi sveža sardela , ali pa kruhu primešamo zmečkane slane sardele ali pri pripravi uporabimo tekočino , ki jo oddajo sardele pri soljenju .",0.0,0
SSVOVSVO,1.0,"V predstavi Kapital je zelo pomembno nekaj , kar lahko odpre v gledališču nove možnosti uprizarjanja , t. j. vrtljivi prostor , v katerem sedijo gledalci in spremljajo dogajanje okoli sebe .",0.0,0
SSVOVVO,3.0,"( ČEPRAV JE BILO TRANSVESTITSTVO TEDAJ KAZNIVO , SE JE TRGOVKA OBRNILA STRAN IN JI DOVOLILA IZBRATI OBLAČILA . )",0.0,0
SSVS,3.0,"» To je pozitivno , kajti v nasprotnem primeru bi se najmočnejše svetovno gospodarstvo pregrelo , kar bi",0.0,0
SSVSOV,1.0,"Natanko taka bi bila lahko vest prejšnji teden v Dnevniku , kajti vse to se je na Brniku res zgodilo , a Dnevnik in tudi drugi časopisi tega niso objavili , ker . . .",0.0,0
SSVSOVO,1.0,"Tisto kar bo ostalo od Libeskindovega načrta , sta spektakularna mestna trga , kakršna sta na Manhattnu popolnoma neznana , vzpenjajoči se obris Vrtov sveta na nebu in najbolj inteligenten spomenik , ki ga je bilo mogoče postaviti žrtvam 11. septembra .",0.0,0
SSVSOVVVVOVO,0.0,0,1.0,mi pri Zvezi prijateljev mladine Slovenije bi bili najbolj veseli če bi bilo humanitarnega dela torej skrbi konkretno za otroke družino za zbiranje sredstev da bi bilo vsega tega manj in več tega drugega dela teh naših programov ki jih peljemo z vso odgovornostjo ker vemo da so dobri ker vemo da prebujajo v otrocih e njihovo participacijo njihovo kritično miselnost in ki vzpodbujajo talente in udejanjanje njihovih interesov
SSVSSV,1.0,"Navidez je bilo vse lepo in uspešno , a podrobnejša analiza dogajanja pokaže , da je slovenska glasbena scena hudo problematična , in to postaja žal že konstanta ali prevladujoča praksa .",0.0,0
SSVSV,0.0,0,1.0,tisti je tisti je pa spet on je pa
SSVSVO,2.0,"Program je primeren predvsem za večje organizacije , kjer je v navezi s programom Symantec Enterprise Security Manager odličen par , saj slednji skrbi , da se vsi člani omrežja držijo iste varnostne politike oz. predpisov .",0.0,0
SSVSVOV,0.0,0,1.0,on je on je dobro izpostavil da da cena tu n- eee nima nobene zveze da je potrebno da pride spet ponovno nazaj v roke države
SSVSVV,1.0,"Postopanje pred afganistanskim veleposlaništvom , širjenje govoric o tem , kdo bo med prvimi letel v Afganistan in kakšne so možnosti , da se sploh uvrstiš na seznam čakajočih , so postali del novinarskega vsakdana .",0.0,0
SSVSVVO,1.0,"To pa je lahko zelo neprijetno tako za mladostnika kot za njegove starše , kajti starši z velikim zadovoljstvom opazujejo , kako njihov otrok na svojem začenja živeti samostojno življenje .",0.0,0
SSVSVVSS,0.0,0,1.0,in mogoče je bila to napaka da smo bili v prvem valu preveč pridni in premalo previdni in e tudi sam opa- sem opažal enako kot sta e oba sogovornika omenila da je bilo v prvem valu bistveno več sole- solidarnosti tudi sam sem takrat
SSVV,7.0,"Kakšen november je pred nami , lahko samo ugibamo .",5.0,roki ki so bili do zdaj zapisani da se to mora zgoditi do leta dva tisoč devet so nerealni
SSVVO,6.0,""" Dejstvo , da so se predlagatelji vlade dr. Andreja Bajuka odločili za tožbo , pove več stvari .",1.0,to so konkretne zadeve konkretne številke eem tako da jaz mislim da s tem stanjem ne moremo biti zadovoljni da državo in odločevalce
SSVVOOSV,1.0,"Zato da bodo ulice in stavbe lepše na pogled , prebivalci poslej ne bodo smeli več sušiti perila na balkonih oziroma tako , da bi ga lahko kdo videl .",0.0,0
SSVVOS,1.0,"Če so lasaste slušne celice poškodovane , slušni sistem ne more spremeniti mehanskega nihanja baziliarne membrane v živčne impulze , kar se navzven",0.0,0
SSVVOSVV,0.0,0,1.0,pomembna ampak eee ta ki sem jaz naštel pa so ostala med slovenskimi pripovedniki oziroma pesniki in jih mi danes bi rekel lahko mirno uvrščamo tudi v kanon slovenske literature
SSVVOV,2.0,"Čeprav je jasno , da je manananggal plod bujne domišljije , je takrat mnogo ljudi trdno verjelo , da obstaja , in še po toliko letih se ga še vedno bojijo .",0.0,0
SSVVOVS,0.0,0,1.0,in zato ni nenavadno če je revija tako kot s- so prej Problemi pisali o novem romanu in tako naprej eee če so zdaj eee priobčili članke tistih tujih avtorjev ki so pisali o tem kaj da je postmodernistična književnost
SSVVOVVVO,0.0,0,1.0,gospodarske razmere v svetu so tako zapletene da naj bi danes Obama še enkrat dal prešteti glasove ali bo sploh zmagal zato ker se boji prevzeti te razmere
SSVVS,3.0,"Prvi , lesen slavolok zmage je bil zgrajen v naglici , potem ko je Romunija postala neodvisna ( 1878 ) , tako da so lahko pod njim korakale zmagovite čete .",0.0,0
SSVVSSO,1.0,"Prejšnje je bilo poplavljeno , voda se še ni pričela umikati , merjasec je ranjen in ves trop je močno potreben krepilnega spanca in hrane …",0.0,0
SSVVSVO,1.0,"Takratna odločitev Bernarda II. , da Kostanjevica postane vsestransko središče Dolenjske , je razumljiva , saj v tem času ni bilo naselbine , ki bi v negotovih razmerah visokega srednjega veka lahko prevzela to vlogo .",0.0,0
SSVVV,1.0,"Koroška bo , če se ozračje ne bo kmalu izboljšalo , zares ponovno postala provinca , kot je včasih že bila .",1.0,predvsem je pa zanimivo to da se ljudje s celega sveta srečajo in se primejo za roke in lahko odplešejo
SSVVVOO,1.0,"Otroci , pri katerih nasičenost s kisikom znaša manj kot 92 % , morajo dobiti kisik , bolnike s hudim krupom pa",0.0,0
SSVVVOV,1.0,"Prekinitev stavke je dopustna , če se stranki KDS , ki se želita pogajati in doseči sporazum , prav zaradi tega dogovorita za njeno prekinitev (",0.0,0
SSVVVS,2.0,"Gospod novinar Miran Šubic je 23. maja 1998 v članku z naslovom "" Boljši Američani kot sosedje "" zapisal , češ da sem izjavil : "" Če prihaja k nam tuji kapital , je",0.0,0
SSVVVSV,1.0,"Da je začudenje še večje , napor sploh ni večji kot tisti , ko sem še malo prej kobacal v pršiču in ugibal , kako bi se ustavil v ledeniški krnici , če bi se sneg na gladkih ploščah speljal .",0.0,0
SV,986.0,"Depresivna motnja se lahko ponavlja , v takšnih primerih",341.0,dobro jaz se nisem eem
SVO,807.0,"Dolgoročno gledano ne bo noben analgetik odpravil vozličkov , zaprtja in blokade tega območja .",85.0,eee kako ste pa vi iskali svojega cimra sostanovalca cimra
SVOO,48.0,"Nokia 7270 ima na boku gumb , ki je namenjen samo tej funkciji .",5.0,[name:personal] pa ful gleda komu si to
SVOOO,0.0,0,1.0,jaz pa zdaj tule gledam eno položnico in mi je prav zanimivo prizidek si
SVOOOOOV,0.0,0,1.0,tako da jaz imam zdaj že čez trideset dni dopusta ne samo zdaj mi ga je pa ene pet dni mi ga je samo še ostalo
SVOOOV,4.0,Potem je Levin vzel Lindstradtovo anodno pištolo in tok ter si ju obesil za pas .,0.0,0
SVOOOVO,1.0,"Nekaterim od njih država obljublja nadomestno gradnjo na zemljišču , ki naj bi si ga sami izbrali , hkrati pa jih pri tem tudi",0.0,0
SVOOOVOOVSO,1.0,"Vlada Republike Slovenije dodeli sredstva Ministrstvu za kmetijstvo in gozdarstvo , ki jih v skladu s programom sanacije škode po suši iz leta 1993 dodeli občinam na podlagi deleža ocenjene škode v vrednosti kmetijske proizvodnje , ki jo je prizadela suša posameznim upravičencem .",0.0,0
SVOOOVOSS,1.0,"Bi potem kakšen slabo plačan član maturitetnih komisij za nagrado lahko domov odnesel tudi izpitno vprašanje ali dve ali pa morda "" svojim "" dijakom maturitetni izbor izpitnih tem zožil na ravno pravo mero , da bi jim bila matura nekoliko prijaznejša , maturitetni "" iztržek "" šole pa na koncu",0.0,0
SVOOOVS,1.0,"Zavarovalnica v okviru zavarovalne vsote plača tudi morebitno kavcijo , ki bi jo zavarovancu naložilo sodišče , ter sodne stroške .",0.0,0
SVOOOVV,2.0,"Zunanji minister Dimitrij Rupel je pisal pismo poslancem državnega zbora in jih prosil , naj premislijo o njeni kandidaturi .",0.0,0
SVOOS,4.0,Popoldnevi tam predstavljajo naši družini velik užitek in predvsem otroci vsakič znova - smo zelo redni,1.0,organizator absolutni svetovni prvak predlani v Las Vegasu in lani v Bariju pa seveda močno pogreša sponzorsko in medijsko podporo kakršne je svetovno prvenstvo deležno na zahodu
SVOOSOVV,1.0,"Po ustanovni listini Združenih narodov lahko članica ZN uporabi silo v samoobrambi brez odobritve VS sicer res legalno in legitimno , a samo , če jo država , pred katero se brani , napade z oboroženo silo .",0.0,0
SVOOSV,5.0,"Sociobiološka teorija inkluzivne pripravljenosti je okrog organizma in njemu sorodnih zapečatila nekakšno ovojnico , ki pa jo je evolucijska teorija poznih sedemdesetih in osemdesetih vedno znova odpirala .",1.0,kdo pa je to d- to ste vi dobili
SVOOSVO,5.0,"Ker je neuspeli predsedniški kandidat in » edini slovenski politični zapornik « Joško Joras na dan državnosti na svoji hiši spet obesil slovenski zastavo , so jo hrvaški policisti odstranili , sodniku za prekrške pa",1.0,pol bomo mi ponovili tisto kar naj bi oni bili vprašani in ponovili bomo čase
SVOOSVVV,1.0,"Ogenj je zajel tudi hišo , vendar so jo neumorni gasilci in dobri ljudje iz doline in okolice , ki so prihiteli na pomoč , uspeli rešiti .",0.0,0
SVOOV,54.0,"minute , ko je Perić po Pajovičevi seriji ubranil sedemmetrovko Lubeju , ki je dotlej grozil z novim strelskim rekordom in senzacijo .",5.0,no mi smo dali njegov- njegovo pravo ime in tokrat smo si ga malo privoščili
SVOOVO,16.0,Ta reakcija upočasnjuje razvoj vina in mu daje kompleksnost v barvi in okusu .,0.0,0
SVOOVOO,0.0,0,1.0,eem In sicer strokovnjaki so doma eee snemali video vsebine eee in pa nasvete eee ki smo jih potem objavljali na spletni strani našega rehabilitacijskega programa potem uporabnikom smo to
SVOOVOOV,1.0,"Deteljica je rastlina , ki je nekega davnega dne v betlehemskem hlevčku mehčala skromno ležišče svetemu Detetu in hranila živali , ki so ga grele s svojo toplo sapo .",0.0,0
SVOOVOOVSVVOVVO,1.0,"Ker je tako razumevanje konteksta zelo omejujoče in ne odpira dovolj prostora za prepoznavanje zapletenih odnosov med jezikom in govorom po eni strani in njunih konkretnih okolij po drugi strani , bomo pojem konteksta določili širše , medtem ko bomo pojav , ki ga opisuje Jakobson , imenovali označeni zunajjezikovni fenomen , ki pomeni del celotnega potencialno označenega univerzuma , o katerem se s pomočjo jezika lahko govori , torej univerzuma , ki vsebuje ne samo realni svet , ampak tudi vse človeške virtualne svetove .",0.0,0
SVOOVOSVO,1.0,"Ko kateri od testnih ljudi zapusti sobo , v kateri mu dajo na voljo nov izdelek , na primer nov depilator , strokovnjaki lahko izvedo veliko novega .",0.0,0
SVOOVOV,2.0,"Dvojčki ljubijo klepet in opravljive čenče , zato pogumno na dan s sočnimi novicami , ki ste jih prebrali v časopisu , reviji ali jih slišali pri prijateljih in znancih .",0.0,0
SVOOVOVO,2.0,"Slovenija bo ohranila državni kapitalizem , ki bo tistemu , ki bo vodil vlado , vedno omogočala vmešavanje v podjetja .",0.0,0
SVOOVOVOVOV,1.0,"ZJU DOLOČA ŠTIRI OCENE , IN SICER : DA DELO OPRAVLJA ODLIČNO , DELO OPRAVLJA DOBRO , DELO OPRAVLJA ZADOVOLJIVO IN DELO OPRAVLJA NEZADOVOLJIVO ( 113.",0.0,0
SVOOVOVS,3.0,"Če kdo ne izpolni norme OKS , ali nastop odpove zaradi poškodbe , bolezni . . . , ga bo zamenjala rezerva .",0.0,0
SVOOVOVSVOVO,1.0,"Ali je slišala Keza , kako mlajšim otrokom pripoveduje zgodbe , po katerih se je zdelo , da je Vrana lastnoročno rešila vse čarodeje v skupini ter obenem potolkla vsaj pol federalne vojske .",0.0,0
SVOOVOVVOO,1.0,"Odbor je tudi predlagal matičnemu Odboru za finance in kreditno monetarno politiko , da navedeni predlog za izdajo zakona o dohodnini z osnutkom zakona , ki pomeni dejansko uveljavitev univerzalnega otroškega dodatka , obravnava in predlaga Državnemu zboru Republike Slovenije uvrstitev na dnevni red te 8. seje zbora .",0.0,0
SVOOVOVVOS,1.0,"Šimeljček pa je pred njiju vedno znova postavljal nove in nove zahteve ter ju prepričeval , da tega ali onega nikakor ne zmoreta , ter si zamišljal poteke svojih ur jahanja po svoje , kar naj bi",0.0,0
SVOOVOVVSO,1.0,"Zato Warner kot neverjetno ironično ocenjuje samopodobo tobačne industrije , ki je nedavno zdravstveno uničujoče posledice rednega kajenja » prevedla « v ekonomski jezik - in jih predstavila kot čisti plus , od katerega ima država lahko samo koristi ( prihranek pri pokojninah ) .",0.0,0
SVOOVS,22.0,"» Pozna uveljavitev zahtevane tehnične zakonodaje za majhna in srednje velika podjetja bo pomenila izgubo koristi , ki jih bo prinesel skupni evropski trg , « je",1.0,ja da ti vidiš kaj so meni pripravili enkrat babe dol
SVOOVSOVSOVSVS,1.0,"Pomembno za današnji čas je , da je krščanstvo novačilo predvsem mlade , ki so jih odbijale neustrezne vrednote starejše generacije , ki jih ni zanimal prenos premoženja , odvisen od poroke , ki so bili utrujeni od nespametnega pehanja za bogastvom in močjo in ki se jim je gnusila družba , ki je po njihovem mnenju » uživala v spolni razuzdanosti « ( tako so kristjani",0.0,0
SVOOVSOVSS,1.0,"rečeno , igralec v gledališki igri igra določeno vlogo , kjer umetniški akt predstavlja najprej vloga sama , kot si jo je zamislil pisec , avtor drame , in drugič igralčeva interpretacija le - te , pri performansu pa avtor umetnik",0.0,0
SVOOVSOVVVO,1.0,"Misel , da imata v rokah nekaj , česar ni odkril še nihče drug , le onadva , ju je tako vznemirila , da tudi naslednjega dne nista odšla v Portorož zapravljat denarja .",0.0,0
SVOOVSS,4.0,"Toledo V5 skriva svojih 170 konjskih moči za enako zunanjostjo , kot jo imajo šibkejše različice , zato je to rjoveči bik v ovčji koži .",0.0,0
SVOOVSSVVOOOV,0.0,0,1.0,eni imajo dosti s- samo jim jaz lahko se tolažimo s tem ka tisti kateri imajo dosti ne bodo imeli na koncu nič ne ker bodo jim vse vzeli
SVOOVSV,2.0,"Oljčno olje namreč spodbuja sproščanje holecistokinina , hormona v dvanajstniku in tankem črevesu , ki možganom sporoča , naj se hranjenje ustavi .",0.0,0
SVOOVSVO,1.0,"Duh nestrpnosti bi lahko odgnal alkoholike , ki bi jim , če ne bi bilo tovrstnih neumnosti , lahko rešili življenje .",0.0,0
SVOOVV,9.0,Vsak spol zahteva določene posebnosti pri odbiri plemenjakov in to bomo poskušali opisati v nadaljevanju .,2.0,Izrael je tudi vpoklical več eee eee tisoč rezervistov ki se še urijo in pripravljajo tudi na morebitne izredne razmere na severni fronti
SVOOVVO,6.0,"Takšno razmerje sil , ki je posledica nasprotovanja Zahoda vstopu pravašev v vlado , onemogoča vodji HDZ Sanaderju , da bi Hrvaško kmečko stranko ( HSS ) izsiljeval z argumentom , da v primeru njihovih pretiranih zahtev lahko sestavi koalicijo s HSP .",0.0,0
SVOOVVOOVVVO,1.0,"Človek lahko povzroči škodo tako , da nekaj stori ali pa ne stori nečesa , kar bi moral storiti , torej opusti dolžno ravnanje .",0.0,0
SVOOVVOSV,1.0,"Nihče ne bo oporekal temu , da je Slovenijo zlahka mogoče označiti kot najbolj stabilno od šestih republik , ki so nekoč sestavljale na propad obsojeno jugoslovansko federacijo , kar sicer , kot si boste mislili , ne",0.0,0
SVOOVVOV,3.0,"Ker je več kot očitno , da je vodilna kultura že posrkala vse subkulture , jih prežvečila in zmešala z drugimi , bi bilo nespametno neki nočni klub voditi le za absolutno alter sceno .",0.0,0
SVOOVVOVO,1.0,"Ko je Ramsay iskal argon , mu je uspelo tudi prvič izolirati helij , in sicer medtem ko je segreval mineral klevit .",0.0,0
SVOOVVOVOV,1.0,"Če igralec hote preizkuša zamah navzdol tako , da ga ustavi , še preden se z glavo palice dotakne žogice , se šteje , da udarca ni izvedel .",0.0,0
SVOOVVSVOVO,1.0,"Prav tako kot lahko nekatere bakterije črpajo dušik iz zraka in ga izločajo kot nitrate , znajo druge prebaviti nitrate in vrniti dušik v atmosfero .",0.0,0
SVOOVVV,1.0,"Ta stari nasvet onemogoča vsakršno razsodbo , kajti nekoga obsojamo ravno zato , ker se ne moremo postaviti na njegovo mesto .",0.0,0
SVOOVVVO,1.0,"ROL Ko je Berlusconijev mikrokirurg zagledal Ljubljenega vodjo , ki ga je obiskal ob vrnitvi iz Davosa , se je bridko zjokal in za vedno odložil instrumente .",0.0,0
SVOOVVVOOVVO,1.0,"Otroci imajo lutke radi , lutki verjamejo , se z njo sprostijo , ne bojijo se je , ji zaupajo in z njo premagujejo razne stiske .",0.0,0
SVOS,80.0,"Kar zadeva podočnjake , je stvar malce bolj",17.0,letos sem jaz prekinila pisanje pravljic kjer kjer je obvezen srečen konec
SVOSO,6.0,Poročilo je razburilo duhove po vsem svetu ; eni so podvig peterice,0.0,0
SVOSOO,0.0,0,1.0,ne ker on tukaj ni uporabljal gradbeni material on si tega
SVOSOV,6.0,"ORGANIZACIJA OZIROMA DELODAJALEC PO ZDR LAHKO ORGANIZIRA DELO NA DOMU , ČE NARAVA DELA TO DOPUŠČA ( 26.",0.0,0
SVOSOVO,1.0,"Srečanje je imelo pridih neresničnega pridih nečesa , kar mu je spet vzbudilo živčne končiče .",0.0,0
SVOSOVS,1.0,"Henrik je sklical sinodo šestindvajsetih nemških škofov , in ta je Gregorja odstavila ; ena od obtožb je bila njegovo vsem znano "" škandalozno",0.0,0
SVOSOVV,2.0,"In ljudje si ponavadi želijo tistega , kar se jim zdi , da od življenja lahko pričakujejo .",0.0,0
SVOSOVVS,1.0,"Ker Združene države Amerike in EU ubirata povsem drugačne demografske poti , naj bi bilo število Američanov , ki jih je danes okoli 93 milijonov manj , kot je prebivalcev v državah članicah EU , leta 2050 za 58 milijonov večje kot v uniji .",0.0,0
SVOSOVVV,1.0,"Ko so škofi pretresli dokaze , so si bili edini , da je papež kriv , in so ga hoteli odstaviti ter obsoditi na smrt , tedaj pa je",0.0,0
SVOSSV,0.0,0,1.0,to pa je seveda imelo velik vpliv na otroke saj je šola v Sloveniji prostor kjer se stvari homogenizirajo
SVOSSVO,1.0,"Ker je naša država že v prvem krogu dobila več kot polovico glasov , drugi krog glasovanja ( če v prvem nobena država ne dobi večine ,",0.0,0
SVOSSVV,1.0,"Zagovornici selitve , predstavnica mesta Francka Trobec , načelnica mestnega oddelka za predšolsko vzgojo , izobraževanje in šport ter ravnateljica glasbene šole Lučka Winkler - Kurent , sta prepričevali starše , da je selitev smotrna , saj bi se glasbena dejavnost za to področje lahko odvijala v enem glasbenem centru v Reboljevi ulici v adaptiranih prostorih vrtca Ciciban in kasneje še v prizidku OŠ Milana Šušteršiča , ki se nahaja v bližini , ne pa da je razbita po sedmih različnih lokacijah .",0.0,0
SVOSSVVSV,0.0,0,1.0,v kolikor bomo mi dobili jasno sporočilo na drugi strani da je vinjenost nekaj kar se sigurno ne splača potem ne verjamem da j- smo Slovenci tako neumni da bomo še s- sedli vinjeni za volan
SVOSSVVVO,1.0,"tak , kakršen je , vreden ljubezni , in vsak lahko tak , kakršen je , pomaga graditi lepši in boljši svet .",0.0,0
SVOSV,28.0,"» Komisija verjame trditvi , da strokovni svet ni izrecno razpravljal o znamki miz , gotovo pa bi",4.0,to je čisto naša ideja se pravi eee s- kompletno zamisel je slovenska pamet ustvarila
SVOSVO,9.0,Že sama raznoličnost nujno zahteva pojasnilo – a zakaj bi to zbujalo skrb ?,2.0,v bistvu ti oni tako kot so oni uničili besedo sproščenost si ti uničil besedo čka
